{
  "schema_version": "vocomipedia-pack-1",
  "pack_code": "fr_a1",
  "title": "French A1",
  "language": "fr",
  "lang_prefix": "fr",
  "lang_level": "a1",
  "level": "A1",
  "target_sentence_key": "jp",
  "reading_sentence_key": "fu",
  "data_pack_code": "fr_a1-b1",
  "source": {
    "kind": "legacy_json",
    "json": "/Users/dimitristaufer/Documents/Creative Media Solutions/App Development/vocomi/vocomi_pack_generation/language_packs/french_A1/french_A1_structure.json",
    "asset_dir": "/Users/dimitristaufer/Documents/Creative Media Solutions/App Development/vocomi/vocomi_pack_generation/language_packs/french_A1"
  },
  "items": [
    {
      "id": "fr_a1:2000e101a9b7357c",
      "entry_id": "de",
      "file": "items/de-2000e101a9b7357c.json",
      "order": 0
    },
    {
      "id": "fr_a1:1b3ae7ec19c0757e",
      "entry_id": "être",
      "file": "items/tre-1b3ae7ec19c0757e.json",
      "order": 1
    },
    {
      "id": "fr_a1:41e7b8c1686e6d16",
      "entry_id": "la",
      "file": "items/la-41e7b8c1686e6d16.json",
      "order": 2
    },
    {
      "id": "fr_a1:db4ebffe24d95d92",
      "entry_id": "je",
      "file": "items/je-db4ebffe24d95d92.json",
      "order": 3
    },
    {
      "id": "fr_a1:ce79bba5879715a6",
      "entry_id": "et",
      "file": "items/et-ce79bba5879715a6.json",
      "order": 4
    },
    {
      "id": "fr_a1:37171daff3d186a7",
      "entry_id": "ne",
      "file": "items/ne-37171daff3d186a7.json",
      "order": 5
    },
    {
      "id": "fr_a1:12042d3c88defbc3",
      "entry_id": "à",
      "file": "items/12042d3c88defbc3.json",
      "order": 6
    },
    {
      "id": "fr_a1:df8b7f861858b53a",
      "entry_id": "le",
      "file": "items/le-df8b7f861858b53a.json",
      "order": 7
    },
    {
      "id": "fr_a1:0bf738e253c94002",
      "entry_id": "avoir",
      "file": "items/avoir-0bf738e253c94002.json",
      "order": 8
    },
    {
      "id": "fr_a1:9035ba1a8973a895",
      "entry_id": "pas",
      "file": "items/pas-9035ba1a8973a895.json",
      "order": 9
    },
    {
      "id": "fr_a1:98d8d100e547af15",
      "entry_id": "il",
      "file": "items/il-98d8d100e547af15.json",
      "order": 10
    },
    {
      "id": "fr_a1:3d41d02a02a1781b",
      "entry_id": "un",
      "file": "items/un-3d41d02a02a1781b.json",
      "order": 11
    },
    {
      "id": "fr_a1:68d871ee4545a7e7",
      "entry_id": "les",
      "file": "items/les-68d871ee4545a7e7.json",
      "order": 12
    },
    {
      "id": "fr_a1:a0ecfdb80910ab02",
      "entry_id": "d'",
      "file": "items/d-a0ecfdb80910ab02.json",
      "order": 13
    },
    {
      "id": "fr_a1:633e9fb67d64d8d4",
      "entry_id": "l'",
      "file": "items/l-633e9fb67d64d8d4.json",
      "order": 14
    },
    {
      "id": "fr_a1:bc1fd400d5920960",
      "entry_id": "une",
      "file": "items/une-bc1fd400d5920960.json",
      "order": 15
    },
    {
      "id": "fr_a1:f5f7e1fb4c71a902",
      "entry_id": "tu",
      "file": "items/tu-f5f7e1fb4c71a902.json",
      "order": 16
    },
    {
      "id": "fr_a1:a734cb7f0a2b9a42",
      "entry_id": "vous",
      "file": "items/vous-a734cb7f0a2b9a42.json",
      "order": 17
    },
    {
      "id": "fr_a1:670ebbe17c9d9163",
      "entry_id": "en",
      "file": "items/en-670ebbe17c9d9163.json",
      "order": 18
    },
    {
      "id": "fr_a1:57a601343e94b174",
      "entry_id": "faire",
      "file": "items/faire-57a601343e94b174.json",
      "order": 19
    },
    {
      "id": "fr_a1:268b6fd1243d8a66",
      "entry_id": "des",
      "file": "items/des-268b6fd1243d8a66.json",
      "order": 20
    },
    {
      "id": "fr_a1:f19b49ca8a51eeee",
      "entry_id": "qui",
      "file": "items/qui-f19b49ca8a51eeee.json",
      "order": 21
    },
    {
      "id": "fr_a1:a4d88a908144bba1",
      "entry_id": "on",
      "file": "items/on-a4d88a908144bba1.json",
      "order": 22
    },
    {
      "id": "fr_a1:fe9a74909aef5845",
      "entry_id": "pour",
      "file": "items/pour-fe9a74909aef5845.json",
      "order": 23
    },
    {
      "id": "fr_a1:732b62fe7d5bbf73",
      "entry_id": "dans",
      "file": "items/dans-732b62fe7d5bbf73.json",
      "order": 24
    },
    {
      "id": "fr_a1:ae474ee2ef5271f3",
      "entry_id": "aller",
      "file": "items/aller-ae474ee2ef5271f3.json",
      "order": 25
    },
    {
      "id": "fr_a1:79bf38aea355c01a",
      "entry_id": "elle",
      "file": "items/elle-79bf38aea355c01a.json",
      "order": 26
    },
    {
      "id": "fr_a1:e570784274a374a4",
      "entry_id": "du",
      "file": "items/du-e570784274a374a4.json",
      "order": 27
    },
    {
      "id": "fr_a1:30329f5cc0fe569b",
      "entry_id": "ça",
      "file": "items/a-30329f5cc0fe569b.json",
      "order": 28
    },
    {
      "id": "fr_a1:e07d23cfbb869b98",
      "entry_id": "dire",
      "file": "items/dire-e07d23cfbb869b98.json",
      "order": 29
    },
    {
      "id": "fr_a1:61f4525f3c0d5676",
      "entry_id": "se",
      "file": "items/se-61f4525f3c0d5676.json",
      "order": 30
    },
    {
      "id": "fr_a1:98a8f14098727c0d",
      "entry_id": "mais",
      "file": "items/mais-98a8f14098727c0d.json",
      "order": 31
    },
    {
      "id": "fr_a1:204ac08f6db92919",
      "entry_id": "plus",
      "file": "items/plus-204ac08f6db92919.json",
      "order": 32
    },
    {
      "id": "fr_a1:56b6ebe46f974592",
      "entry_id": "me",
      "file": "items/me-56b6ebe46f974592.json",
      "order": 33
    },
    {
      "id": "fr_a1:f00079017c2ac64a",
      "entry_id": "au",
      "file": "items/au-f00079017c2ac64a.json",
      "order": 34
    },
    {
      "id": "fr_a1:46ce47dc4c0afa58",
      "entry_id": "pouvoir",
      "file": "items/pouvoir-46ce47dc4c0afa58.json",
      "order": 35
    },
    {
      "id": "fr_a1:d770214f02c43090",
      "entry_id": "nous",
      "file": "items/nous-d770214f02c43090.json",
      "order": 36
    },
    {
      "id": "fr_a1:299eb8196e783249",
      "entry_id": "ce",
      "file": "items/ce-299eb8196e783249.json",
      "order": 37
    },
    {
      "id": "fr_a1:b0e17433903d8e92",
      "entry_id": "sur",
      "file": "items/sur-b0e17433903d8e92.json",
      "order": 38
    },
    {
      "id": "fr_a1:00207d72ddcb6c48",
      "entry_id": "avec",
      "file": "items/avec-00207d72ddcb6c48.json",
      "order": 39
    },
    {
      "id": "fr_a1:4a886b7cdfb09095",
      "entry_id": "s'",
      "file": "items/s-4a886b7cdfb09095.json",
      "order": 40
    },
    {
      "id": "fr_a1:9ebcefc88d463dc2",
      "entry_id": "y",
      "file": "items/y-9ebcefc88d463dc2.json",
      "order": 41
    },
    {
      "id": "fr_a1:21eeaee913fd4bdc",
      "entry_id": "vouloir",
      "file": "items/vouloir-21eeaee913fd4bdc.json",
      "order": 42
    },
    {
      "id": "fr_a1:c0f3a12bdbcb0cab",
      "entry_id": "que",
      "file": "items/que-c0f3a12bdbcb0cab.json",
      "order": 43
    },
    {
      "id": "fr_a1:dec37d256f999a8e",
      "entry_id": "bien",
      "file": "items/bien-dec37d256f999a8e.json",
      "order": 44
    },
    {
      "id": "fr_a1:6057396dd899a285",
      "entry_id": "lui",
      "file": "items/lui-6057396dd899a285.json",
      "order": 45
    },
    {
      "id": "fr_a1:71e4381ca388f209",
      "entry_id": "voir",
      "file": "items/voir-71e4381ca388f209.json",
      "order": 46
    },
    {
      "id": "fr_a1:20afb6426919d2d9",
      "entry_id": "savoir",
      "file": "items/savoir-20afb6426919d2d9.json",
      "order": 47
    },
    {
      "id": "fr_a1:699ee47eb35a2341",
      "entry_id": "mon",
      "file": "items/mon-699ee47eb35a2341.json",
      "order": 48
    },
    {
      "id": "fr_a1:e462f5a897f94cab",
      "entry_id": "son",
      "file": "items/son-e462f5a897f94cab.json",
      "order": 49
    },
    {
      "id": "fr_a1:fad6bcb933d1a61d",
      "entry_id": "tout",
      "file": "items/tout-fad6bcb933d1a61d.json",
      "order": 50
    },
    {
      "id": "fr_a1:ec991d10984c8e57",
      "entry_id": "ils",
      "file": "items/ils-ec991d10984c8e57.json",
      "order": 51
    },
    {
      "id": "fr_a1:f8ccd17bb8512750",
      "entry_id": "moi",
      "file": "items/moi-f8ccd17bb8512750.json",
      "order": 52
    },
    {
      "id": "fr_a1:7155dc9029748e50",
      "entry_id": "comme",
      "file": "items/comme-7155dc9029748e50.json",
      "order": 53
    },
    {
      "id": "fr_a1:bbead9b01972b13b",
      "entry_id": "par",
      "file": "items/par-bbead9b01972b13b.json",
      "order": 54
    },
    {
      "id": "fr_a1:40c89d7d9ada820b",
      "entry_id": "non",
      "file": "items/non-40c89d7d9ada820b.json",
      "order": 55
    },
    {
      "id": "fr_a1:72ed77d7a548fbec",
      "entry_id": "t'",
      "file": "items/t-72ed77d7a548fbec.json",
      "order": 56
    },
    {
      "id": "fr_a1:2144f7f67e46e012",
      "entry_id": "sa",
      "file": "items/sa-2144f7f67e46e012.json",
      "order": 57
    },
    {
      "id": "fr_a1:0596dbdb3dbb30e6",
      "entry_id": "te",
      "file": "items/te-0596dbdb3dbb30e6.json",
      "order": 58
    },
    {
      "id": "fr_a1:af5d9fd34d16c704",
      "entry_id": "devoir",
      "file": "items/devoir-af5d9fd34d16c704.json",
      "order": 59
    },
    {
      "id": "fr_a1:a1acbec0caa7f893",
      "entry_id": "venir",
      "file": "items/venir-a1acbec0caa7f893.json",
      "order": 60
    },
    {
      "id": "fr_a1:b318164cafb306b7",
      "entry_id": "où",
      "file": "items/o-b318164cafb306b7.json",
      "order": 61
    },
    {
      "id": "fr_a1:ed4d08a583738eb3",
      "entry_id": "cette",
      "file": "items/cette-ed4d08a583738eb3.json",
      "order": 62
    },
    {
      "id": "fr_a1:d3e4bc5aa88b1e1a",
      "entry_id": "ma",
      "file": "items/ma-d3e4bc5aa88b1e1a.json",
      "order": 63
    },
    {
      "id": "fr_a1:2e64ea76ea01e60f",
      "entry_id": "rien",
      "file": "items/rien-2e64ea76ea01e60f.json",
      "order": 64
    },
    {
      "id": "fr_a1:d76027f6cf7395a9",